<?xml version="1.0" encoding="utf-8"?>
<!DOCTYPE ComponentRegistry PUBLIC "ComponentRegistry.dtd" "ComponentRegistry.dtd" >

<!--
This registry file contains common database- and persistence- related settings
-->
<ComponentRegistry>
    <Node name="FUNC_FRMWK_SRV">

        <!-- Database/JDBC/Embedded SQL/TOPLink related settings-->
        <Node name="Persistence">

			<!-- Settings for the Java wrapper of NEXTFREE stored procedures. -->
			<Node name="NEXTFREE">
				<!-- 
				Specifies fetch size for a particular sequence.
				If a sequence is found in the list than NEXTFREE.GetNumValues with 
				array interface will be used with specified fetch size
				
				If a sequence isn't found in the list than NEXTFREE.GetValue 
				will be used (no array interface and caching)
				 -->
				<Node name="FetchSizePerSequence">
		        </Node>
	        </Node>
				
            <!-- Contains KeyValue entries holding the package names of all packages with
                 persistent classes. Each of the packages listed here is assumed to contain
                 a class 'BOregister', which must add the descriptors of the package to the
                 list of all application descriptors.
            -->
            <Node name="PackageNamesForBORegistry">
            </Node>
            
            <!--Contains a list of reference data classes, that should be refreshed 
                periodically.
             -->
            <Node name="RefreshReferenceData">
            </Node>
            
              <!-- 
           	List of Oracle errors that lead to a reset of the database connection pool.
				    This leads to a reconnect at the next access.
			      -->
            <Node name="OraErrorsToReconnect">
		        <KeyValue key="17002" value="" type="String"/>
		        <KeyValue key="17008" value="" type="String"/>
            </Node>
            
            <!-- 
            List of Oracle error codes returned in case when the database
            is not availiable or restarted.           
            SOI server terminates immediately when Oracle returns such error code
            -->
            <Node name="OraErrorsToTerminate">
		        <KeyValue key="1012" value="" type="String"/>
		        <KeyValue key="1033" value="" type="String"/>
		        <KeyValue key="1034" value="" type="String"/>
		        <KeyValue key="12500" value="" type="String"/>
            </Node>
            
            <!-- 
            At login time these Oracle error codes leads to
            a SecurityException
            -->
            <Node name="OraErrorsSecurity">
		        <KeyValue key="28000" value="" type="String"/>
		        <KeyValue key="28001" value="" type="String"/>
		        <KeyValue key="28002" value="" type="String"/>
		        <KeyValue key="28005" value="" type="String"/>
		        <KeyValue key="28009" value="" type="String"/>
		        <KeyValue key="28011" value="" type="String"/>
		        <KeyValue key="17443" value="" type="String"/>
  		        <KeyValue key="17433" value="" type="String"/>
            </Node>
            
            <!--
            Translation of the Oracle "constraint violation" error codes into
            meaningfull domain error codes.
            -->
            <Node name="OraConstraintViolation">
            	<Node name="OraCodes">
            		<!-- 
            		List of Oracle "constraint violation" error codes 
            		-->
		        	<KeyValue key="00001" value="" type="String"/>
            	</Node>
            	<Node name="constraints">
            		<!-- 
            			key: Oracle constraint
            			value: ErrorCode defined in the error dictionary
            		-->
            	</Node>
            </Node>

        </Node>
    </Node><!-- FUNC_FRMWK_SRV -->
</ComponentRegistry>